{
  "$schema": "http://json-schema.org/draft-07/schema#",
  "$id": "https://radar.local/contracts/event-v1.json",
  "title": "EventV1",
  "type": "object",
  "additionalProperties": false,
  "properties": {
    "schemaVersion": {
      "const": 1,
      "type": "integer"
    },
    "eventType": {
      "const": "INCIDENT_CANDIDATE",
      "type": "string"
    },
    "eventId": {
      "type": "string",
      "format": "uuid",
      "pattern": "^[0-9a-fA-F]{8}-[0-9a-fA-F]{4}-[0-9a-fA-F]{4}-[0-9a-fA-F]{4}-[0-9a-fA-F]{12}$"
    },
    "episodeId": {
      "type": "string",
      "format": "uuid",
      "pattern": "^[0-9a-fA-F]{8}-[0-9a-fA-F]{4}-[0-9a-fA-F]{4}-[0-9a-fA-F]{4}-[0-9a-fA-F]{12}$"
    },
    "cameraId": {
      "type": "string",
      "format": "uuid",
      "pattern": "^[0-9a-fA-F]{8}-[0-9a-fA-F]{4}-[0-9a-fA-F]{4}-[0-9a-fA-F]{4}-[0-9a-fA-F]{12}$"
    },
    "runId": {
      "type": "string",
      "format": "uuid",
      "pattern": "^[0-9a-fA-F]{8}-[0-9a-fA-F]{4}-[0-9a-fA-F]{4}-[0-9a-fA-F]{4}-[0-9a-fA-F]{12}$"
    },
    "mode": {
      "type": "string",
      "enum": ["SIMULATED", "REPLAY", "LIVE"]
    },
    "kind": {
      "enum": ["PERSON_ON_FLOOR", "POSSIBLE_FALL"],
      "type": "string"
    },
    "occurredAt": {
      "type": "string",
      "format": "date-time",
      "pattern": "^\\d{4}-\\d{2}-\\d{2}T\\d{2}:\\d{2}:\\d{2}(?:\\.\\d{1,3})?Z$"
    },
    "detectedAt": {
      "type": "string",
      "format": "date-time",
      "pattern": "^\\d{4}-\\d{2}-\\d{2}T\\d{2}:\\d{2}:\\d{2}(?:\\.\\d{1,3})?Z$"
    },
    "sourceOffsetMs": {
      "anyOf": [
        {
          "type": "integer",
          "minimum": 0,
          "maximum": 9007199254740991
        },
        {
          "type": "null"
        }
      ]
    },
    "signals": {
      "type": "object",
      "additionalProperties": false,
      "properties": {
        "floorDurationMs": {
          "type": "integer",
          "minimum": 0,
          "maximum": 9007199254740991
        },
        "torsoAngleDeg": {
          "type": "number",
          "minimum": 0,
          "maximum": 180
        },
        "bboxAspectRatio": {
          "type": "number",
          "exclusiveMinimum": 0,
          "maximum": 1000
        },
        "hipInFloorZone": {
          "type": "boolean"
        },
        "rapidDescentObserved": {
          "type": "boolean"
        },
        "validPoseFraction": {
          "type": "number",
          "minimum": 0,
          "maximum": 1
        },
        "analysisFps": {
          "type": "number",
          "minimum": 0,
          "maximum": 1000
        }
      },
      "required": [
        "floorDurationMs",
        "torsoAngleDeg",
        "bboxAspectRatio",
        "hipInFloorZone",
        "rapidDescentObserved",
        "validPoseFraction",
        "analysisFps"
      ]
    },
    "pose": {
      "type": "array",
      "maxItems": 22,
      "uniqueItems": true,
      "items": {
        "oneOf": [
          {
            "type": "object",
            "additionalProperties": false,
            "properties": {
              "index": {
                "type": "integer",
                "minimum": 11,
                "maximum": 32
              },
              "x": {
                "type": "number",
                "minimum": -1.7976931348623157e308,
                "maximum": 1.7976931348623157e308
              },
              "y": {
                "type": "number",
                "minimum": -1.7976931348623157e308,
                "maximum": 1.7976931348623157e308
              },
              "visibility": {
                "type": "number",
                "minimum": 0,
                "maximum": 1
              }
            },
            "required": ["index", "x", "y", "visibility"]
          },
          {
            "type": "object",
            "additionalProperties": false,
            "properties": {
              "index": {
                "type": "integer",
                "enum": [11, 12, 13, 14, 15, 16, 23, 24, 25, 26, 27, 28]
              },
              "x": {
                "type": "number",
                "minimum": -1.7976931348623157e308,
                "maximum": 1.7976931348623157e308
              },
              "y": {
                "type": "number",
                "minimum": -1.7976931348623157e308,
                "maximum": 1.7976931348623157e308
              },
              "confidence": {
                "type": "number",
                "minimum": 0,
                "maximum": 1
              }
            },
            "required": ["index", "x", "y", "confidence"]
          }
        ]
      }
    },
    "versions": {
      "type": "object",
      "additionalProperties": false,
      "required": ["worker", "model", "policy", "calibration"],
      "properties": {
        "worker": {
          "type": "string",
          "minLength": 1,
          "maxLength": 120,
          "pattern": "^[A-Za-z0-9][A-Za-z0-9._+\\-]{0,119}$"
        },
        "model": {
          "type": "string",
          "minLength": 1,
          "maxLength": 120,
          "pattern": "^[A-Za-z0-9][A-Za-z0-9._+\\-]{0,119}$"
        },
        "policy": {
          "type": "string",
          "minLength": 1,
          "maxLength": 120,
          "pattern": "^[A-Za-z0-9][A-Za-z0-9._+\\-]{0,119}$"
        },
        "calibration": {
          "type": "string",
          "minLength": 1,
          "maxLength": 120,
          "pattern": "^[A-Za-z0-9][A-Za-z0-9._+\\-]{0,119}$"
        }
      }
    },
    "evidenceMode": {
      "type": "string",
      "enum": ["none", "skeleton", "snapshot"]
    }
  },
  "required": [
    "schemaVersion",
    "eventType",
    "eventId",
    "episodeId",
    "cameraId",
    "runId",
    "mode",
    "kind",
    "occurredAt",
    "detectedAt",
    "sourceOffsetMs",
    "signals",
    "pose",
    "versions"
  ],
  "allOf": [
    {
      "if": {
        "properties": {
          "mode": {
            "const": "REPLAY"
          }
        },
        "required": ["mode"]
      },
      "then": {
        "properties": {
          "sourceOffsetMs": {
            "type": "integer",
            "minimum": 0,
            "maximum": 9007199254740991
          }
        }
      },
      "else": {
        "properties": {
          "sourceOffsetMs": {
            "type": "null"
          }
        }
      }
    },
    {
      "if": {
        "type": "object",
        "properties": {
          "versions": {
            "type": "object",
            "properties": {
              "model": {
                "type": "string",
                "const": "rtmo-s-body7-640x640-20231211-onnx-v1"
              }
            },
            "required": ["model"]
          }
        },
        "required": ["versions"]
      },
      "then": {
        "type": "object",
        "properties": {
          "pose": {
            "type": "array",
            "items": {
              "type": "object",
              "additionalProperties": false,
              "properties": {
                "index": {
                  "type": "integer",
                  "enum": [11, 12, 13, 14, 15, 16, 23, 24, 25, 26, 27, 28]
                },
                "x": {
                  "type": "number",
                  "minimum": -1.7976931348623157e308,
                  "maximum": 1.7976931348623157e308
                },
                "y": {
                  "type": "number",
                  "minimum": -1.7976931348623157e308,
                  "maximum": 1.7976931348623157e308
                },
                "confidence": {
                  "type": "number",
                  "minimum": 0,
                  "maximum": 1
                }
              },
              "required": ["index", "x", "y", "confidence"]
            }
          },
          "versions": {
            "type": "object",
            "properties": {
              "policy": {
                "type": "string",
                "pattern": "^floor-rtmo-score-"
              }
            }
          }
        }
      },
      "else": {
        "type": "object",
        "properties": {
          "pose": {
            "type": "array",
            "items": {
              "type": "object",
              "additionalProperties": false,
              "properties": {
                "index": {
                  "type": "integer",
                  "minimum": 11,
                  "maximum": 32
                },
                "x": {
                  "type": "number",
                  "minimum": -1.7976931348623157e308,
                  "maximum": 1.7976931348623157e308
                },
                "y": {
                  "type": "number",
                  "minimum": -1.7976931348623157e308,
                  "maximum": 1.7976931348623157e308
                },
                "visibility": {
                  "type": "number",
                  "minimum": 0,
                  "maximum": 1
                }
              },
              "required": ["index", "x", "y", "visibility"]
            }
          }
        }
      }
    }
  ]
}
