{
  "schemaVersion": 1,
  "eventType": "INCIDENT_CANDIDATE",
  "eventId": "11111111-1111-4111-8111-111111111111",
  "episodeId": "22222222-2222-4222-8222-222222222222",
  "cameraId": "33333333-3333-4333-8333-333333333333",
  "runId": "44444444-4444-4444-8444-444444444444",
  "mode": "SIMULATED",
  "kind": "PERSON_ON_FLOOR",
  "occurredAt": "2026-10-21T12:00:00.000Z",
  "detectedAt": "2026-10-21T12:00:02.000Z",
  "sourceOffsetMs": null,
  "signals": {
    "floorDurationMs": 2000,
    "torsoAngleDeg": 75,
    "bboxAspectRatio": 0.7,
    "hipInFloorZone": true,
    "rapidDescentObserved": false,
    "validPoseFraction": 1,
    "analysisFps": 5
  },
  "pose": [],
  "versions": {
    "worker": "fixture-v1",
    "model": "none-simulator",
    "policy": "floor-v0.1",
    "calibration": "synthetic-v1"
  }
}
